{
  "schema_version": "1.0.0",
  "manifest_version": "1.0.0",
  "session_id": "live-session-2026-05-25",
  "status": "in_progress",
  "producer": {
    "name": "symposium-reference",
    "version": "0.1.0"
  },
  "created_at": "2026-05-25T12:00:00Z",
  "updated_at": "2026-05-25T12:03:17Z",
  "artifact_path": "artifact.json",
  "config_path": "config.json",
  "journal_path": "transcript.jsonl",
  "notes": "Reference example: live session journal sidecar. artifact.json absent until session ends."
}
