{
  "schema_version": "1.0.0",
  "manifest_version": "1.0.0",
  "session_id": "demo-2026-05-25-001",
  "status": "complete",
  "producer": {
    "name": "symposium-reference",
    "version": "0.1.0"
  },
  "created_at": "2026-05-25T10:00:00Z",
  "updated_at": "2026-05-25T10:18:42Z",
  "artifact_path": "artifact.json",
  "config_path": "config.json",
  "journal_path": "transcript.jsonl",
  "transcript_digest": "f26b6aad4de1860893eab0a177330c9fb564b18f7011598ea968da3d306e7270",
  "outcome_kind": "synthesis",
  "notes": "Reference example for §7.2. Synthesis path; 2 rounds; one fork; one defer."
}
